,clean_hex
1934,curfew next may free school oblig like famili best damn curfew
1935,curfew daviskawalya know mauryn say final goodby grandpa seen news rip alway open idea may curfew
1936,curfew peopl realli still curfew even amp graduat high school
1937,curfew stupid niggr tell mom past curfew oth
1938,curfew cancel cat doctor appoint decid go play come home curfew
1939,curfew info r curfew oper z taxiway foxtrot amp foxtrot navbl wnd exp inst apch rwi damp tmp qnh
1940,curfew lie though pay oldest sometim like first get car curfew freedom donthat
1941,curfew info u cld sct bkn exp inst apch rwi curfew oper z taxiway foxtrot amp foxtrot navbl tmp wnd
1942,curfew rite man tlk widout nuh curfew long side aka cum fi steal di show itz rubberi di whole dem fi knw sound music
1943,curfew dont even come worri curfew bc
1944,curfew got whole curfew
1945,curfew hour late curfew pray dog bark unlock door
1946,curfew da judg gave di girl pm curfew
1947,curfew begin summer mom made curfew back never go wonder alway home
1948,curfew charli lim start pm sunday curfew leh
1949,curfew u bomb u tri get home curfew
1950,cyclon awwww babi walter rewatchingthepilot teamscorpion cyclon
1951,cyclon big ten annual footbal media day get cyclon hoop recruit nugget
1952,cyclon camera art photographi new bolt 
1953,cyclon mccauleysdesign abysmaljoin dyamiplotk work purpos larg cyclon would better k
1954,cyclon new tropic cyclon form near guam form call molav
1955,cyclon video new de jhaustin thoma cyclon ame tribun ame tribun video new de jhaustin thoma on 
1956,cyclon xhnew need plant pacif cyclon season would help
1957,cyclon bbc forc retract fals claim cyclon pam via wordpressdotcom
1958,cyclon great condit easton cyclon softbal bat fastpitch sk
1959,cyclon sever weather bulletin typhoon  
1960,cyclon cyclon deriv power calm center person norman vincent peal
1961,cyclon roughdeal ant hudhud cyclon chandrababu vall ne ant ga
1962,cyclon cyclon komen devast famili myanmar week need help today
1963,cyclon sever weather bulletin tropic cyclon warn typhoon hanna issu p thursday august
1964,cyclon back futur vanuatu cyclon pam encourag tradit way live
1965,cyclon bank manag ask tom interview cyclon tom loan given purchas bicycl
1966,cyclon excit cyclon footbal
1967,cyclon bbc forc retract fals claim cyclon pam via wordpressdotcom
1968,cyclon talent misdirect cyclon pass ignit pass vanish drive phantom shot kurokobot
1969,cyclon comdev asia radio station bangladesh broadcast program address upcom cyclon komen
1970,cyclon like cyclon imperi spin across globe militar crush peopl suck blood like
1971,cyclon mercuri cyclon gt hood mould nice core cobra jet cj gt
1972,cyclon cyclon passion overblown
1973,cyclon majesti emperor salman khan unstopp cyclon entertain humanitybajrangi bhaijaan creat histori everywher crose cr
1974,cyclon mercuri cyclon gt quarter panel rear trim mould cobra jet cj
1975,cyclon tropic cyclon info soudelor hpa maximum wind speed maximum wind gust speed
1976,cyclon cyclon reizei may ask cyclon sama read jail fate rindou
1977,cyclon drug alcohol jackson vroman hous
1978,cyclon blend old new vanuatu prepar futur emerg
1979,cyclon wfp wfp deliv food bangladesh flood victim tropic cyclon komen dhaka  
1980,cyclon rohingya hous kyee nockthi hamlet taungbazar region buthidaung sever damag cyclon kasitaroch vivianunhcr
1981,cyclon cyclon doubl g would cherri top outfit ootd doubleghat
1982,damag thelegendblu cozmo probabl allow us ascend get damag max valu
1983,damag drop nigga damag
1984,damag union say support london yet prepar damag econom  
1985,damag like youtub video gta onlin collater damag gta v onlin pc
1986,damag fyi accid properti damag limeston ln col yellowston way fieldston dr
1987,damag fit knee damag solut
1988,damag complain phoenix mode fire emblem turn ray gigant difficulti option take damag
1989,damag capicapricapri brento bento wha kid damag
1990,damag clear accid properti damag ny eb ny
1991,damag crazi phone much damag person
1992,damag writebothfist got pretti windi damag
1993,damag reus advanc life equip transit drum champaign damag fdbdp
1994,damag indigo e car spot damag time check time give away baggag loss wy
1995,damag storm damag report west tennesse
1996,damag hey royal love damag out
1997,damag drothvad cm nevalisti keep pleas arachi piec deal weapon damag
1998,damag mage fairi tail special properti damag natsu dragneel
1999,damag bradleybrad yeah fast extrem high damag want fast im gon na get u
2000,damag bradleybrad saw fast af great damag upgrad shitton use exclus whole playthrough
2001,damag let say tree fall fenc know homeown insur may help
2002,damag joedawg tor tor situat wind damag enhanc word key imo
2003,damag hfxstanfield beelievedc discoverycntr happen hear runway light damag contractor
2004,damag swb nda written damag abil offer servic futur prolli want work anyway
2005,damag trillion cross line rd time field wide attack instant kill damag
2006,damag np metallica damag inc
2007,damag nine inmat charg caus damag calgari remand centr riot
2008,damag pt cross sectarian protest power shia cleric say militia must withdraw ur fightin isi wont forget damag uve done ur ppl
2009,damag homeown insur cover water damag good thing know
2010,damag beach damag shit
2011,damag wonderousallur cross arm cover hand anymor damag h hello
2012,damag new post blog thesensualey model cam damagetoronto apr nsfw pussi ass boob asian nude  
2013,damag report hit amp run roadway properti damag statesvil rd
2014,damag devil may cri special edit vergil vs agnu window mission dmd damag leedstraif
2015,damag glaucoma occur fluid build pressur insid eye level may damag optic nerv eyefact
2016,damag jsunnew storm damag report madison counti thunderstorm damag report ar via
2017,damag punctur wound without foreign bodi left index finger without damag nail initi encount icd
2018,damag thank richarkkirkarch ausinstarchitect word warn queenswharf brisban via financialreview
2019,damag real shit damag bitch
2020,damag lmao fuckboy chang damag control pseudojuuzo
2021,damag michaelwestbiz standard damag control
2022,damag gettinglost jennellensbb muncl jim said superfici wound pepper spray damag
2023,danger blizzhero dustinbrowd dad chase constantli amp time frequent great deal danger distract lt
2024,danger believ shirt compani everi anim ever danger better start see chang wildlif
2025,danger danger union bear
2026,danger sign open fall danger releas day blast review tour sign
2027,danger dyannbridg yeshayad check rockin preview claytonbry danger zone come soon artistsunit
2028,danger red flag warn fire danger amp dri thunderstorm bay area weather cawx nwsbayarea
2029,danger carsonrex spaceangelseven check rockin preview claytonbry danger zone come soon artistsunit
2030,danger like could danger someth
2031,danger last tree cut last fish eaten last stream poison realiz
2032,danger take away preserv park r imposit amp danger african peopl never imagin
2033,danger indian govt amp media take seriou concern safeti danger
2034,danger train grain wheat bare gold august heat anger trespass lest seek danger
2035,danger therealrittz fettilootch slanglucci oppress greatest danger come soon album
2036,danger morehous appear govt lost ethic moral relev mean whole usa popul danger
2037,danger like head first slide especi home danger
2038,danger permit bear hunt danger outnumb actual bear licens florida fir st petersburg
2039,danger riverroam much danger pleas
2040,danger bluebirddenv fettilootch slanglucci oppress greatest danger come soon album
2041,danger uber look repair recent bad rap nonprofit partnership
2042,danger wish could get victoria secret front good
2043,danger turnedonfetaboo hsjb check rockin preview claytonbry danger zone come soon artistsunit
2044,danger thetxi gunnersfan would arsen fan want west ham releg battl season danger afc sun
2045,danger remainontop fettilootch slanglucci oppress greatest danger come soon album
2046,danger nugget fettilootch slanglucci oppress greatest danger come soon album
2047,danger danger excit underwat cave dive
2048,danger girl wan na save like danger health tri somebodi wan na somebodi els
2049,danger gun protect shit realli use unless life danger
2050,danger thirsti yall danger dehydr
2051,danger thunderstorm littl rain expect central california high fire danger weather cawx
2052,danger wan na get danger day tattoo bad cool would spider look like someon wrist smth
2053,danger experi alway angri critic pundit grave danger go rail
2054,danger danger skyler danger
2055,danger danger ok rest us danger
2056,danger investig robert mueller respond complaint sinc nov amp left son danger
2057,danger honestli tho modibo maiga steal live fuck im past best still danger fucktard coyi
2058,danger fear way make us see danger none contempl logic behind situat find courag engag
2059,dead joel book act
2060,dead dead afghanistan aircraft crash afghan militari helicopt crash remot region
2061,dead silent siri even awesom nors landscap load atmospher life bore dead snotgreen wasteland
2062,dead miss longer hair dead anyway even hair
2063,dead cjban sake argsuppos pre born attain individl right gener courtof law forbid kill unless dead person someth
2064,dead rememb time goku gave life dead birb hell goku
2065,dead naaa bee dead like legit zombi feel everi sore part bodi
2066,dead happen get road right behind buse dead seriou
2067,dead lmfao fuck lui hhahaha im dead
2068,dead watch emmerdal nd know slightli attract man name ross got beat nd dead
2069,dead soapscoop need confirm ross dead caus dont trust anyon els yh
2070,dead gailsimon iwasdisappointedbi telltal walk dead good charact amp stori real gameplay mani perform issu
2071,dead beforeitsnew hundr fear dead libyan migrant boat capsiz rescu  
2072,dead it 
2073,dead jone kyle oh fuck sake dead
2074,dead emmerdal ross realli dead askcharley
2075,dead avoid wear dead black flame red stark white much esp debat go blue gold brown even shoe
2076,dead perspect grate dead critic write contribut studi
2077,dead hlportal hello look mod cold ice saw site link download dead mayb share thank
2078,dead kg vaal lmaov v hard ny new trend babalmao welcom nyozi kwaaaaa dead
2079,dead jone kyle said dead one els die
2080,dead ross dead noooooooooooo mikeparractor
2081,dead think time friend bail nite b dead show went alon amp great time alon free danc front row
2082,dead typhoon soudelor take dead aim taiwan
2083,dead askcharley emmerdal emot ross dead emmerdal
2084,dead man found dead demi moor swim pool
2085,dead val dead im su
2086,dead atchisonsean dead
2087,dead wyrmwood road dead fuck awesom awesom end awesom one
2088,dead believ ross dead emmerdal mikeparractor emmerdal summerf
2089,death call text nigga bff amp boyfriend love boy death nigga hold attent like
2090,death hate talk otp grandma mean love death talk damn much ssshhheeesshh
2091,death death forev rep jet
2092,death vibrat shape vape done bust
2093,death death threat nigga life well gon see
2094,death adult die plagu colorado
2095,death xbox pro consol red ring death full read ebay
2096,death go back gainesvil death
2097,death year later ferguson see chang ask it 
2098,death papiichampoo enjoy obama era civil prez say gop support iranian death
2099,death feel like death
2100,death like youtub video jeromekem dj hazard death sport
2101,death tell cousin wan na hang text say come honestli death wish
2102,death rss judg order texa recogn spous sex death certif
2103,death loyalti mission involv kick shitti nobleman death love elven weirdo
2104,death way seemeth right unto man end thereof way death
2105,death kellkan thank narrowli avert death fun right
2106,death arianagrand screamqueen katherin death
2107,death allahsfinest death muslim
2108,death go starv death
2109,death ted cruz bash obama comparison gop iranian shout death america
2110,death arianagrand screamqueen katherin death
2111,death new crime know right punish death
2112,death issu upload death smoochi awaken clip youtub reason bicentenni man pain ass
2113,death ted cruz bash obama comparison gop iranian shout death america tcot
2114,death cypru news analysi mullah omar death may split taliban rank omar demis would certainli lead
2115,death feel like death holi moli
2116,death video slain mexican journalist unknowingli predict death via breitbartnew
2117,death old ladi rockin death metal sedan downtown smoke cigarett found real mom
2118,death afghan peac talk doubt mullah omar death financi time mullah
2119,death pusssssssssi shoook death
2120,death first trial death cecilthelion postpon
2121,death year ago week anniversari marilyn monro death ripriprip
2122,death ari hint snippet death
2123,death tomorrow death
2124,death new nyc legionnair diseas death toll rise follow
2125,death vaxshil death measl complic yr everyon loos shit dead legionnair month amp cricket
2126,death bigamist  
2127,death get south huge wreck airlift mayb death interst complet block
2128,death  
2129,death silenc palermo shipwreck children death
2130,death bsf jawan die fidayeen ak bloodi insa insa rifl blame soldier death mod
2131,death breast milk origin superfood rate worldwid stall contribut child death last year
2132,death death red light run crash pedestrian bicyclist amp vehicl occup hit red light runner
2133,death rt truediagnosi k death per year physician error avoid one
2134,death cdcwhistleblow death measl complic yr everyon loos shit dead legionnair month amp cricket
2135,death bigamist first wife charg death second pregnant wife child news
2136,death death year foodborn ill frackfreelanc dear deccgovuk frackfre eu tarleton sophi
2137,death hear drfriedencdc talk avoid thousand resist infect death next yr adiossuperbacteria
2138,death ironi die thousand death
2139,death strickskin nickscom lol usual object mayb uncl ben cours death end busi usual
2140,death comment death older children data tell us nghlth
2141,death death
2142,death eazzi p never know would happen govt seem think belief warrant death innoc jap
2143,death real magic real life women went miss ohio town focu fbi probe strang death
2144,death two case constitut epidem plagu health publichealth
2145,death death
2146,death lunch stewart amp julian coupl hour earlier good final find happen
2147,death weyburn polic warn public fentanyl death provinc
2148,death none annoy crusti live matter head ass peopl ever actual support caus hate black death get attent
2149,death time reduc gun death
2150,death gregorysand usdot amp stat high auto death appli children vehicl guess run lightrail better adult
2151,death cancer equat around death blackpool kow sign could save life
2152,death highqualitybird revers situat lol know us civilian death specif util make polit
2153,death heard there two death murder chrissi kill adam val finn die emmerdal
2154,death mathew angri z ke sk saladinahm die horribl death trap ship knew risk
2155,death fco minist tobia ellwood condemn attack mosqu saudi arabia result least death
2156,death cancer equat around death blackpool kow sign could save life
2157,death critter climat two plagu death colorado
2158,death sinc year angela sander born roundhous kick relat death increas percent
2159,death walmart take step keep children safe hot vehicl take look innov car seat
2160,death beluga death report seaworld averag age year opseaworld
2161,death bigamist first wife charg death second pregnant wife child moth
2162,death mayoroflondon pl reduc cyclist death compulsori highway code test everi vehicl use road notrocketsci
2163,debri aerospac exec plane debri miss mh part aircraft wing found reunion island th
2164,debri malaysia airlin flight disappear month ago debri found south indian ocean
2165,debri mh aircraft debri found la reunion miss malaysia airlin
2166,debri discov plane debri miss malaysia airlin flight time
2167,debri confirm debri mh
2168,debri mh aircraft debri found la reunion miss malaysia airlin
2169,debri malaysia confirm plane debri wash reunion island flight mh
2170,debri mh aircraft debri found la reunion miss malaysia airlin
2171,debri miss jet 
2172,debri r 
2173,debri r 
2174,debri debri found reunion island flight mh mysteri behind plane disappear could better novel
2175,debri mh aircraft debri found la reunion miss malaysia airlin
2176,debri reuter debri confirm mh rel hope discoveri crash site
2177,debri nbcnightlynew malaysian offici say debri found reunion island mh billneelynbc report
2178,debri mh debri found reunion island sad tragedi innoc crash mh
2179,debri love food fun malaysian prime minist najib razak confirm aircraft debri found r 
2180,debri malaysia seem certain franc plane debri miss mh
2181,debri malaysian offici say debri found reunion island mh billneelynbc report
2182,debri mh aircraft debri found la reunion miss malaysia airlin
2183,debri debri found reunion island come mh malaysian pm
2184,debri aircraft debri found island mh malaysia confirm
2185,debri ironi debri flight mh found reunion island
2186,debri mh aircraft debri found la reunion miss malaysia airlin abc onlin
2187,debri mh reunion debri miss malaysia flight
2188,debri expert leav lab malaysia confirm debri mh
2189,debri malaysia confirm plane debri wash reunion island flight mh
2190,debri kamindoz reuter debri confirm mh rel hope discoveri crash
2191,debri plane debri discov reunion island belong flight mh  
2192,debri debri confirm mh rel hope discoveri crash site malaysian offici confirm breakth
2193,debri abc onlinemh aircraft debri found la reunion miss malaysia airlin abc onlinea piec aircraft debri
2194,debri malaysia confirm reunion island debri mh scmp news
2195,debri debri confirm mh rel hope discoveri crash site via reuter video
2196,debri plane debri miss mh
2197,debri mh aircraft debri found la reunion miss malaysia airlin abc onlin g malaysia news
2198,debri interest mh aircraft debri found la reunion miss malaysia airlin abc pleas rt
2199,debri aircraft debri confirm mh nation star onlin
2200,delug dustpiggi ah awash abstract dustpig tweet explain delug
2201,delug xeni bet mother natur might plan send delug way
2202,delug joshsternberg feed seem delug twice week it 
2203,delug romeocrow welcom organ twitter find import stuff amongst delug btw love music sign ep
2204,delug niagara fall packag deal delug tour yyeso
2205,delug apologis sincer inevit delug gbbo tweet come hold grudg decid unfollow bake cake
2206,delug rt nlm dimrc delug resourc flood medic provid cleanup worker amp
2207,delug towboat trek sympathi delug fall vtc
2208,delug delug eulog cecilthelion whatsapp gt gt torment soul matia xavier
2209,delug wa smile juli delug west australian via yahoo
2210,delug china delay delug fundament economi support valuat stock
2211,delug despit delug fantasticfour notic man cuana still buy ticket bloodi mind like
2212,delug photo forrestmankin colorado camp
2213,delug delug troi rivier one hour get legionstrackandfield
2214,delug mani half nake men twitter tonight normal embrac odd torso scale tonight delug unpreced
2215,delug theburnageblu ye man bad week far event delug fav turn right around
2216,delug best window torrent client recommend delug look like written year ago java swing use wors
2217,delug fifth pre dynast king legendari period delug dumuzid shepherd
2218,delug theghostparti sorri delug hell vine
2219,delug strang encaust cerographi portion till give voic delug byityf
2220,delug back beach delug surf camp motion surf therapi programm kick today
2221,delug stephaniemarija light rain forecast base dress light rain incess delug
2222,delug perhap histor appli delug recent expos childsexabus truli histor scale cover
2223,delug bibl sometim back truck unload descript delug indec us chuckswindol explain iflcanada next
2224,delug audio busi owner share would differ pt
2225,delug whole slew updat post come host fix unfml delug
2226,delug photo boyhau heaven sent jake 
2227,delug f amp ing thing gishwh got soak delug go pad tampon thx mishacollin
2228,delug fiendnikki delug awesom word idea like much
2229,delug wrinkl face delug decay
2230,delug schelbertgeorg thank teach onlin class amp ask student lot question like sorri delug ren art
2231,delug shadowman save big easi delug supernatur monstros read free
2232,delug hough jeff crap content market delug dougkessl b b b bagenc via slideshar contentmarket
2233,delug love song heal delug amp want sing church spanish translat
2234,delug vinc mcmahon billionair rememb read delug post vinc mcmahon lose
2235,delug nfl play deflateg perfectli delug increment stori bore world care want go away
2236,delug search power content improv busi frustrat delug quantit 
2237,delug miss asa exhibitor email valu assnchat
2238,delug meditationbymsg ppl got method medit u p amp got delug divin bless happi n peac life
2239,delug uk delug canadian theme top around time perfect quit believ mad
2240,delug tomorrow internet day almost month look forward delug stuff avoid downright lie
2241,delug novalismi joseph mallord william turner shade dark even delug clicca sul titolo
2242,delug anyon els get ton telemarket call cell phone delug
2243,delug thewesterngaz sure shop delug local children want buy realli
2244,delug susi delug invoic make stlnd colour shape like rise top pay pile
2245,delug glimps hyderabad delug heavi rainfal
2246,delug busi delug invoic make stand colo r shape lzkeli rise top pay pile
2247,delug also matter week amazon go delug poorli written indi dystopian fiction teen escap blood farm
2248,delug busi delug invoic make stand colour shape like ri togth top pay pile
2249,delug busi abe delug invoic make stand colour shape like rise top pay pile
2250,delug delug low self imag take quiz
2251,delug busi delug invokc make stand colour shape like rise top pay pile
2252,delug lisatoddsutton reason bring bcz run senat murphi noth republican delug junk mail
2253,delug delug low self imag take quiz
2254,delug thesewphist whoever hold address fuckfac wineisdumb com go delug spam meant
2255,delug tarp protect outfield move infield get delug
2256,delug busi delug inroic make stand colour shape like rise top pay pile
2257,delug eu state squabbl immigr uk franc eurotunnel delug migrant one dead thousand storm tunnel
2258,delug busi delug invoic make stand oup colour shame like rise top pay pile
2259,delug busi delug invzic make stand colour shape sllike rise top pay pile
2260,delug busi delug invoic make stand colour shape like rise top e pay pileq
2261,delug accionempresa u depart commerc delug last two month com gerenciatodo  
2262,delug feel delug low self imag take quiz
2263,delug busi delug invoic make stand ogt colomr shape like rise top pay pile
2264,delug busi delug invoic make ur stand colour shape like rise top pay pile
2265,delug vald forgiv bit testi delug hatr amp lost patienc
2266,delug news alert glimps hyderabad delug heavi rainfal
2267,delug afterward alon hour savour prolong almost physic intens feel delug sigu
2268,delug come back gt gt fli ant day capit delug annual swarm wing insect
2269,demolish rand paul debat strategi demolish bad idea point mayb em
2270,demolish enugu govern demolish illeg structur intern confer centr
2271,demolish enugu govern demolish illeg structur intern confer centr enugu state govern app
2272,demolish doon silver architect permiss demolish birmingham natwest tower replac city 
2273,demolish us four demolish createduniqu keren serpa arianare
2274,demolish enugu state govern appear set recov portion enugu intern confer ce badotweet
2275,demolish kirkmin listen demolish barthubbuch weei wait bait patriot hater co worker bradi discuss
2276,demolish ugh hungri go demolish food
2277,demolish demolish deep space etoff charmeus clothesless precisionist vestment psfda
2278,demolish enugu govern demolish illeg structur intern confer centr
2279,demolish enugu govern demolish illeg structur intern confer centr
2280,demolish xgn infin ronin carbon hahah mutual host preset bal nade radar demolish
2281,demolish yea gon na demolish boundari seem unconsci set neg thought
2282,demolish noth midget demolish show respect
2283,demolish set goal demolish fit inspir
2284,demolish set goal amp demolish
2285,demolish rt abbswinston zionist terrorist demolish palestinian structur jordan valley
2286,demolish mariomaraczi watch right freak st first fight demolish guy
2287,demolish think akwa ibom don 
2288,demolish read alreadi remain one favorit articl ever let 
2289,demolish imagin kp root demolish everyon
2290,demolish absurdli ridicul men 
2291,demolish far right racist avigdorliberman call destruct susiya previous also call behead
2292,demolish could demolish right
2293,demolish postal servic agre sell demolish downtown build
2294,demolish news updat enugu govern demolish illeg structur intern confer centr via daili post
2295,demolish complet quest demolish murlo android game tribez androidgam gameinsight
2296,demolish jolli jinu said terrorist babri ok demolish hous todayhav right take reveng
2297,demolish think becom businessman demolish commun centr build condo foil troup multi racial breakdanc
2298,demolish first counter leagu game anoth orianna happen demolish xd total appreci peopl play
2299,demolish think go demolish drake hous ghostwrit shit know rihanna live next door
2300,demolish ad video youtub playlist dan arin demolish giant gummi bear grumpout
2301,demolish nah srsli b u demolish ur partner face amp start dribbl nostril stop amp ask urself whether realli worth embarrass
2302,demolish charminar demolish fall state anyway take engin opinion telangana
2303,demolish beastin tapa even good folk funtim demolish
2304,demolish urib demolish ball
2305,demolish bought oz jar peanut butter get demolish
2306,demolish colt get demolish patriot like whine nfl integr cantmakeitup patriotsn
2307,demolish flunki make feel better level still get demolish
2308,demolish angusmacneilsnp everi case ye utterli demolish utterli i 
2309,demolish stiiilo still got video u demolish
