,clean_hex
3820,first respond thank first respond especi mnpdnashvil life save respons today antioch
3821,first respond juneau empir first respond turn nation night
3822,first respond red throw word hero around lightli usual reserv first respond militari hero
3823,first respond us want futur first respond high tech
3824,first respond still room parti first respond around countri rd annual best ever
3825,first respond incas accid first respond would know babi present
3826,first respond kirsten gillibrand extend health care first respond
3827,first respond help say denver firefight work curb first respond suicid
3828,first respond first respond conven nation summit award gi technolog gisuserpr geotech
3829,first respond york co first respond compet save live  
3830,first respond good info help first respond cope individu resili factsheet respond
3831,first respond iaffloc live lost except first respond public charg protect
3832,first respond first respond get int bridgeportspe free saturday detail
3833,first respond day emerg servic display meet brave polic firefight first respond help keep us safe
3834,first respond week first respond dart member particip four day intens technic larg anim
3835,first respond firefight make gain rockyfir jerri brown head area meet first respond tomorrow morn
3836,first respond shoot event theater starbuck give free coffe first respond polic amp firefight antiochhickoryhollow tn
3837,first respond lender fee veteran first respond past present linkedin
3838,flame new giant flame giant full black pantofel info order sm pin pic twitter com pnpizodi
3839,flame new snap tool black basebal hat cap silver gray embroid logo flame full re 
3840,flame new snap tool black basebal hat cap silver gray embroid logo flame full re 
3841,flame vampiro go tabl flame ultimalucha luchaunderground elreynetwork
3842,flame cabin fever flame
3843,flame summon flame directli hell store bought fine mom die
3844,flame ad fire flame saturday rick wonder spin guest set along chachi
3845,flame kelworldpeac taxston yoga flame
3846,flame sbnation flame make good penalti killer
3847,flame guess say ig hope went flame
3848,flame cri piti parti flame
3849,flame new lil b x chanc noth flame
3850,flame gilderoy wish good enough add flame nail im fire
3851,flame gang walk round brown flame amp that nd
3852,flame new snap tool black basebal hat cap silver gray embroid logo flame full re 
3853,flame tadhgtgmtel dude smoke fuck thing went flame though bomb went omg scare
3854,flame maryland mansion fire kill caus damag plug christma tree report say flame
3855,flame new giant flame giant manli brown info order sm pin
3856,flame  
3857,flame watch go flame
3858,flame rp said see smoke come silo th street hartford flame
3859,flame chose search joy two us we 
3860,flame maryland mansion fire kill caus damag plug christma tree report say flame firefight braveri
3861,flame erinmariefishi everyon set flame upon
3862,flame flame nation optimist side doubt tough done feel like game pivot defens
3863,flame maryland mansion fire kill caus damag plug christma tree report say flame
3864,flame pardon burst flame enough world peopl mindless game
3865,flame awickedassassin want burst flame anna hug tightli
3866,flame selmoooooo edvinnn imtariik dzafic hari selmo u catch flame im gon na wit slaughter
3867,flame bloodi ell let burn rubybot
3868,flame opinion put thh internet furst flame
3869,flame rise follow graph follow past week get stat right
3870,flame aisumag akumareisu gray ophelia red flame blaze around person set nearli everyth area
3871,flame soloquiero maryland mansion fire kill caus damag plug christma tree report say flame firefight
3872,flame maryland mansion fire kill caus damag plug christma tree report say flame
3873,flame cw hoop better make shot tomorrow caus record flame thrown tomorrow
3874,flame ad video youtub playlist nicki minaj flame offici video
3875,flame better sean bro admit sean flame better sean
3876,flame advantag apropo flame favor regard mississauga ontario pwhvgwax
3877,flatten flatten cartooni like whoa papa
3878,flatten road success pave penni flatten train track welcom
3879,flatten feel like flatten sumo wrestler pain gain muaytai wantmyabsback strong
3880,flatten idea food flatten
3881,flatten zouma flatten cfc
3882,flatten zouma absolut flatten guy
3883,flatten flatten
3884,flatten year ago first atom attack flatten hiroshima day later nagasaki war crime put moscow place
3885,flatten today august th th anniversari bomb littl boy drop hiroshima kill outright citi flatten
3886,flatten would flatten littl midget
3887,flatten said yosemit sam drumpf  
3888,flatten grabakahitman izi garcia flatten machida lose fight nope lost fight guy lost also
3889,flatten floor flatten earli bird get de cup lag bout pun de dock watch ppl drink 
3890,flatten conklin flatten shuffl feet instead kick slide get hand chest
3891,flatten flatten thee striker
3892,flatten pick flatten hay men masonit wahpeton nd
3893,flatten zouma flatten guy
3894,flatten fyld build set flatten one preston 
3895,flatten iamhorsefli hide kid hide wife loos thought flatten ball
3896,flatten would great mbiwa flatten littl rat
3897,flatten jimmozel puck flatten ball lol
3898,flatten doubt implicit statement make want flatten bu
3899,flatten kainyusanagi grummz pixelcanuck flatten raynor raynor bald imperfect biker marin emo gener western hero
3900,flatten seanpeconi jason floyd lynchonsport criscyborg think risk lose get nose flatten lot
3901,flatten mum liter pick new car today flatten batteri alreadi tri sort bluetooth muppet
3902,flatten tweetinglew tersestuff notley flatten harper heartlandharp import ten thousand tfw slave cost albertan job
3903,flatten twilightfairi flatten frog
3904,flatten imagin get flatten kurt zouma
3905,flatten fallaci steam roller object whether flatten robertcalifornia thereisonlysex
3906,flatten photo beach ear beach jewelri vacat ear keep calm beach ear made flatten
3907,flatten mix new flat doubl side linerless bottl cap choos mix flatten full re 
3908,flatten bigburgerboi flat footbal like flatten spartan crush back day hail
3909,flatten satanaofhel ever seen far dreami look came face ear flatten start walk slowli toward
3910,flatten mix new flat doubl side linerless bottl cap choos mix flatten full re 
3911,flood fizzi sit regular flood seat one know
3912,flood jkl cancel flash flood warn bell harlan knox ky wx
3913,flood spot flood combo inch w curv cree led work light bar x offroad fog lamp full re 
3914,flood spot flood combo inch w curv cree led work light bar x offroad fog lamp full re 
3915,flood small flood big 
3916,flood homecom queen kill way home prom flood water socialnew
3917,flood pc w cree led work light offroad lamp car truck boat mine wd flood beam full rea 
3918,flood rain sinc left menow drown floodyou see alway fighterbut without give
3919,flood creationmin rwrabbit gooneratheist atheist lolatjesu yet still mani fish die worldwid flood wonder
3920,flood pleas flood poor robertbenglund mention put work
3921,flood spot flood combo inch w curv cree led work light bar x offroad fog lamp full re 
3922,flood atlarnxx didnt
3923,flood w cree led work light bar alloy spot flood combo dive offroad wd boat full read 
3924,flood pc w cree led work light offroad lamp car truck boat mine wd flood beam full rea 
3925,flood hellotybeeren cue flood peopl iron call
3926,flood motor hot deal gt gt x w v v led work light flood lamp tractor truck suv utv a 
3927,flood v v w led warm white light motion sensor outdoor flood light pir lamp auc
3928,flood iembot hfo nnw hana maui co hi counti offici report coastal flood  
3929,flood pair new w round led work drive flood light road atv utv full read ebay
3930,flood pc w cree led work light offroad lamp car truck boat mine wd flood beam full rea 
3931,flood internet basic flood defect intertissu soul mate milk trench host guabxfv
3932,flood bmx issu areal flood advisori shelbi al till aug pm cdt
3933,flood pc w cree led work light offroad lamp car truck boat mine wd flood beam full rea 
3934,flood flood advisori effect shelbi counti al pm alwx
3935,flood rt grant factori grant fund weymouth meet seawal flood grant set thursday night  
3936,flood spot flood combo inch w curv cree led work light bar x offroad fog lamp full re 
3937,flood spot flood combo inch w curv cree led work light bar x offroad fog lamp full re 
3938,flood spot flood combo inch w curv cree led work light bar x offroad fog lamp full re 
3939,flood flood advisori issu august pm edt nw wxki
3940,flood surviv plagueflo floodjust peek head mudno one immunedeafen bellsmi god surviv
3941,flood spot flood combo inch w curv cree led work light bar x offroad fog lamp full re 
3942,flood flood prone waterway westchest counti elig million state aid newyork
3943,flood chines rescu team arriv myanmar help flood victim sittway
3944,flood flood advisori issu august pm cdt august pm cdt nw urban weather
3945,flood w cree led work light bar alloy spot flood combo dive offroad wd boat full read 
3946,flood rock spring  
3947,flood cuban leader extend sympathi vietnam flood
3948,flood busi spong dock wash rain flood
3949,flood warlord queen thrust littl jam cock deep insid flood womb pussi hot thick cum
3950,flood sever thunderstorm flash flood possibl mid south midwest weather environ climat natur
3951,flood radar updat widespread shower storm move area minor flood possibl hunwx
3952,flood tip prevent basement leak creat control joint elimin random crack homeimprov flood
3953,flood flood
3954,flood adorableapppl report flood po area ten mmda
3955,flood flood kill displac one million pakistan daili news amp analysi yugvani
3956,flood flood kill displac one million pakistan daili news amp analysi
3957,flood lao flood villag underwat world vision respond
3958,flood flood ukflood british trekker rescu amid flash flood himalaya group british tr flood
3959,flood slopeofhop mayb plan dilut safe say start charg long would come flood
3960,flood cuban leader extend sympathi vietnam flood
3961,flood ill dm hotel info peopl flood notif ask info
3962,flood wave flood shoreand find way home anymorethat look
3963,flood flood occur home stop mold growth via proudgreenhom
3964,flood flood track caus derail sa insubcontin insubcontin
3965,flood chines flood nyc market like never
3966,flood obama keep iraqi christian asylum seeker ndetent flood u w unscreen muslim via dcclotheslin
3967,flood grate support flood netkicorp dinner guest thank
3968,flood flash flood madison valleywx
3969,flood themain soon start flood comment section come brazil comment bc
3970,flood last year lot drum flood janic fall
3971,flood  
3972,flood heavi rainfal flood northern vietnam situat report
3973,flood crabbycal oh god memori flood back
3974,flood flood disast burst water pipe flood apart nycha senior center ny ny burst water pipe flood
3975,flood lrt look tom feel flood back
3976,flood myanmar msf assist thousand worst flood decad hit part myanmar
3977,flood resid central part ocean citi heard engin flood mitig option tuesday ocnj
3978,flood wen final get girl want flood yall wit pic us rs tho
3979,flood kwislo see flood mad decent
3980,flood monsoon flood kill dozen myanmar prompt call help
3981,flood memori unveil travi counti deputi kill sept flood travi counti sheriff greg hamilton joined 
3982,flood flood kill displac one million pakistan least peopl kill nearli lakh 
3983,flood thankkk u soo much flood notificationsu fella parshol r superb amp ju soo awesomelov love u alway frvrgrate
3984,flood slip slide away flash flood info writer w toni nester sonoranrattl writingtip
3985,flood bring tornado flood bring climat chang god america plagu farrakhan quot
3986,flood myanmar flood heavi monsoon rain month juli caus flood flash flood landsli
3987,flood india peopl taken shelter relief camp govern set flood
3988,flood pmharper worri sure climat noth hail flood tornado alberta amp ontario sure god mad
3989,flood ictyosaur never thought would wtf moment yet month degre heatnext flash flood
3990,flood grant like half town flood rain still whatev
3991,flood madonnamk rspca site multipl stori high rise build next low densiti charact residenti area flood
3992,flood cyberdemon hope mountain dew erod throat flood lung leav drown death
3993,flood disast group stun flood
3994,flood person amp reckon die brain flood dmt caus reliv life real time simul
3995,flood ever rememb old song someth hear year word carri flood memori along priceless
3996,flood flood fish final sunshin amp fab deal albertson anniversari sale lauren paint beauti life
3997,flood flood disast bengal flood cm mamata banerje blame dvc bjp claim state fail use econom
3998,flood dead due flood myanmar naypyidaw aug prensa latina death toll rose today myanmar
3999,flood typhoon soudelor approach kill miss flood philippin via abc chicago
4000,flood casewrit rain nj flash flood otherwis desert grief tax
4001,flood download itun flood glori luiz santo jazz art music
4002,flood contactenergi yep flood clyde dam releas everi bit water could specci ev charg way
4003,flood bamenda flood kill anim bird
4004,flood hope rain throughout whole weekend hope flood portaloo becom sentient
4005,flood apc chieftain task dickson n b flood donat bayelsa
4006,flood pagasa yellow warn panay island guimara negro possibl flood low lie area amp landslid mountain area
4007,flood rt hourfamin bangladesh govern declar flood emerg worldvis continu m 
4008,flood nearli thousand peopl affect flood paraguay
4009,flood etp bengal flood cm mamata banerje blame dvc bjp claim state fail use relief fund even flood w
4010,flood may allah help suffer pakistan flood famili dua
4011,flood children myanmar face doubl catastroph flood hit
4012,flood love drake flood instagram make feel real tune everyth like sumn
4013,flood bring tornado flood bring climat chang god america plagu farrakhan quot
4014,flood die myanmar flood affect
4015,flood typhoon soudelor approach kill miss flood philippines 
4016,flood memphi alway flood
4017,flood flood caus damag death across asia media content
4018,flood gt soon mainten end everyon flood server gt server destroy extrem load gt mainten start anew
4019,flood bring tornado flood bring climat chang god america plagu farrakhan quot
4020,forest fire e particul break solid combust fossil fuel voltaic activ forest fire biolog voc petroleum ch bacteria decomposit
4021,forest fire care anyon live west beaverton forest grove rapidli spread fire head east
4022,forest fire ad video youtub playlist ori bind forest ep fire death
4023,forest fire one careless match start forest fire take whole box start campfir
4024,forest fire littl forest fire warden
4025,forest fire fire pisgah nation forest grow acr
4026,forest fire ashenforest floorburnt manzanita amp timber johnson fire along ridg forest road routecomplex
4027,forest fire sweet young run set forest fire bite shit neck
4028,forest fire hornybigbadwolf set forest fire
4029,forest fire like youtub video j cole fire squad forest hill drive
4030,forest fire view smoke column rise south end blake fire along forest road routecomplex
4031,forest fire start forest fire put
4032,forest fire fire pisgah nation forest grow acr
4033,forest fire grill school function one grill go pretti much either forest fire inbetween made work
4034,forest fire p watch forest fire smoke lift nuff f make run pet store hwi n b home p
4035,forest fire forest fire socal fire watch ybtheprophet realhiphop
4036,forest fire u forest servic firefight david ruhl die frog fire modoc nation forest temporarili reassign
4037,forest fire usf acronym unit state fire servic
4038,forest fire one careless match start forest fire take whole box start campfir
4039,forest fire prevent forest fire
4040,forest fire naturaldisast california fire rage forest servic sound alarm rise wildfir cost  
4041,forest fire q duck big flat feet stamp forest fire q eleph big flat feet stamp flame duck
4042,forest fire gilmanrock wow rest summer usual worri forest fire calgari hour away
4043,forest fire california fire rage forest servic sound alarm sharpli rise wildfir cost
4044,forest fire littl concern number forest fire live
4045,forest fire nycdivorcelaw trump climat denier alga bloom pacif calif alska seewe caribean forest fire snowbal inhof
4046,forest fire forest servic spend gt budget fight fire
4047,forest fire cartoon bear without would qave knowlddg forest fire toilet paper
4048,forest fire first year forest servic spent half annual budget fight fire climatechang
4049,forest fire california fire rage forest servic sound alarm rise wildfir cost
4050,forest fire reddit lightn spark new fire bois nation forest r stormcom
4051,forest fire spread conflict palmoil spark increas fire destroy forest throughout indonesia
4052,forest fire photo blue forest fire sourc
4053,forest fire cook smokey bear save forest fire face ass
4054,forest fire forest fire amp die salmon time act deni climat chang nightmar bcpoli canpoli vanpoli
4055,forest fire tale tree deep water love lake taho forest fire
4056,forest fire p progress made bois forest fire
4057,forest fire group florida forest servic firefight could deploy california help contain fire detail
4058,forest fire pray east coast forest fire pray put pray rain
4059,forest fire bluejay brave angel instead dump water pleas send british columbia help forest fire
4060,forest fire heartdiseas u forest servic say spend half budget fire
4061,forest fire pharrel prevent forest fire
4062,forest fire climat consequ u forest servic say spend half budget fire
4063,forest fire u forest servic say spend half budget fire
4064,forest fire properti loss northern california wildfir nearli doubl via yahoonew
4065,forest fire inciweb updat rogu river siskiy nation forest fire pm rogu river siskiy nf area 
4066,forest fire forest fire could delay abbyairshow offici say could good thing
4067,forest fire u forest servic say spend half budget fire ian simpson 
4068,forest fire campsit recommend toilet shower pub fire kid pizza shop forest pretti stream midgesno snakesthank
4069,forest fire ur friend u talk forest fire forest tell u drop ur mix tape straightfir
4070,forest fire firefight consum forest servic budget spark polit clash forest servic report cite increas cost of 
4071,hail great michigan techniqu campb g thank bmurph hail youtsey termn r goblu wrestleon
4072,hail np aveng sevenfold hail king
4073,hail hail shadow hybrid mix feat mike szuter youtub youtub
4074,hail tremblayeh like big hail lie sirmixalot
4075,hail lzk issu sever thunderstorm warn wind mph hail sharp ar till pm cdt wx
4076,hail two great dawg dak jak hail state
4077,hail strong thunderstorm mile north japton move se mph larg hail wind gust mph poss arwx
4078,hail rnk issu sever thunderstorm warn wind mph hail rockingham stoke nc till aug pm edt  
4079,hail thank much everyon post rain hail outsid idea guy
4080,hail chojo everyon hail pumpkin king
4081,hail cue storm massiv wind hail power outag wxii davidson counti
4082,hail heyseto enjoy hope epic hail storm go
4083,hail strong thunderstorm mile north japton move se mph larg hail wind gust mph poss arwx
4084,hail hail ladi cheryl reason obsess cheryl cole
4085,hail kmactwn meaganerd look like bowl weather cereal new kellogg sugar hail stay crunchi even milk
4086,hail hail mari full grace lord thee bless art thou among women bless fruit thi
4087,hail seen fahlo wcw hail queen 
4088,hail modnao hail ruin everyth plu car even gotten yet yet anoth killer migrain lost glass
4089,hail faze rain hail cloud
4090,hail new warn central hill hail mph wind affect sturgi could later tonight kotaweath
4091,hail hail zel man kno
4092,hail hail pic  
4093,hail heavi rain lightn overhead oakridg sw calgari least melt hail yycstorm abstorm
4094,hail heyitsepark heavi rain hail
4095,hail weathernetwork come hail
4096,hail flow come atcha boston golfbal size hail yesterday sunni amaz sky today parkchat
4097,hail central mass fruit tree escap heavi damag wind hail
4098,hail new warn central hill hail mph wind affect sturgi could later tonight kotaweath
4099,hail unr continu sever thunderstorm warn wind mph hail lt weston wy custer fall river pennington sd till p 
4100,hail kevin tan say hail chef  
4101,hail hail new caesar
4102,hail calgari pound hail second day storm
4103,hail darkndtat pull holm
4104,hail hi re doppler show storm ne edmond sever hail mph wind possibl okwx
4105,hail unr issu sever thunderstorm warn wind mph hail weston wy custer fall river lawrenc mead pennington s 
4106,hailstorm well much outdoor poster calgaryfring mothernatur hailstorm rain yycfring killhard
4107,hailstorm haley whaley hailstorm hey secret trick get gem clash ofclan check profil
4108,hailstorm nice job calgari transit
4109,hailstorm freak boston hailstorm produc hailstorm busi auto bodi repair specialist peterhowenecn tonight necn
4110,hailstorm omg nixon live richard nixon tricki dicki right pictur hide calgari
4111,hailstorm hail user summon hailstorm last five turn damag pokemon except ice type
4112,hailstorm calgari news weather traffic august
4113,hailstorm adriasimon hailstorm day round yyc yycstorm
4114,hailstorm wick weather roll calgari surround area
4115,hailstorm got ta love summer calgari yyc hailstorm crazyweath
4116,hailstorm sever weather rare hailstorm pummel boston
4117,hailstorm free hailstorm maxi
4118,hailstorm sworn defend proven friend hous hailstorm
4119,hailstorm twin storm blow calgari
4120,hailstorm summer heat drive bobcat calgari backyard
4121,hailstorm readi close errrr nope notgoingoutinthat hailstorm alberta hellonwheelsamc fan talkinghel
4122,hailstorm ig hail abstorm yyc hail hailstorm haildamag yycweath calgari captureyyc alberta sto 
4123,hailstorm summer heat drive bobcat calgari backyard
4124,hailstorm sadli tent fli surviv hailstorm tear roof water tent
4125,hailstorm boston yesterday intens hailstorm x post r cityporn  
4126,hailstorm favorit text
4127,hailstorm canada hailstorm flash flood slam calgari knock power k custom
4128,hailstorm gon na take break work got ta right carlilescanoeliveri lovemyjob
4129,hailstorm sever hailstorm progress northeast logan counti cowx
4130,hailstorm councilscc say hailstorm
4131,hailstorm scare leav car tree storm jamaicaplain boston hailstorm 
4132,hailstorm calgari news weather traffic august
4133,hailstorm stephen ave flower pot got littl rip hailstorm today yyc abstorm calgari iamdowntown
4134,hailstorm grow calgari avoid worst citi wick weather
4135,hailstorm photo scare leav car tree storm jamaicaplain boston hailstorm
4136,hailstorm calgari transit review polici leav hundr commut strand hail 
4137,hailstorm passeng abandon lrt station tuesday hailstorm yyc yycstorm abstorm
4138,harm qualiti metric penalti may harm patient care pcp say primari care physician gener hold posit vi
4139,harm tareksoc think lot celebr treat ppl could harm
4140,harm stick stone may break bonesbut word never harm
4141,harm g anyon tri harm cupcak fuck hunt end earth harrybecar
4142,harm vanderbilt first harm
4143,harm leedsroug love pick play worth fifth harm kid ink listen amp vote
4144,harm imagin doctor treat ebola patient without ever place harm way
4145,harm right annoy actual hung see mean harm audaciousspunk
4146,harm burn self harm way dumbass allow around fire way
4147,harm concur longer spend child harm mmk
4148,harm peopl keep tag self harm fuck
4149,harm dinallyhot love pick play worth fifth harm kid ink listen amp vote
4150,harm pray harm member isi pray experi life reboot love god amp becom paul god mind blow final act
4151,harm safeti improv made rout buffalo harm good
4152,harm inner man wayward rout harm spent replac onlin survey qzloremft
4153,harm anyth happen fuck fli metlif hour away amp beat crap tri harm boy otratmetlif
4154,harm never escap bullet harm noth harm know pain know pain sometim share someon like
4155,harm standard test harm children color via parentsacrossam cc billgat
4156,harm  
4157,harm lauren miller harm
4158,harm angel star obama feel respons bring illeg famili well protect harm feel heart other
4159,harm mean harm best way see fit
4160,harm vilelunar trickshot regular control fuck infinit fade harm gt
4161,harm sex worker say credit card ban onlin ad harm good
4162,harm someon harm angel
4163,harm anyon harm boy would get taken immedi secur fan real quick
4164,harm mani secur gard good dare let someon harm harri otrametlif
4165,harm someon reblog pictur self harm scar oh pleas stop
4166,harm wowsavannah harm collect
4167,harm interview actor randi irwin k could harm
4168,harm hvzlaradio love pick play worth fifth harm kid ink listen amp vote
4169,harm got world bro wan na see harm come way ima lil upset right
4170,harm wwexdream talk pleas harm self way shape form pleas care saw u right u better
4171,harm malistkiss sunni continu believ righteou continu harm shia defeat ideal islam
4172,harm news buffalo ye lot harm good guardrail cant go big problem school start
4173,harm space wolverin harm foul somebodi need say
4174,harm tastemycupcake lmfaooo hell nawh yo ass thought
4175,harm self harm angri pleas tag scar tumblr jesu christ dont wan na get trigger
4176,harm rjg idk feel like movi done harm good make us look sterotyp annddd color preval sort
4177,harm qualiti metric penalti may harm patient care pcp say primari care physician gener hold posit view
4178,harm politician use fals alleg attack plannedparenthood amp harm women fool standwithpp
4179,hazard classycolkett thorgan hazard made move perman go gladbach summer lmao
4180,hazard lifestyl  
4181,hazard longbreastyat yeah think elit either think hazard better player much
4182,hazard choke hazard prompt recal kraft chees singl
4183,hazard see hazard without beard like
4184,hazard get hazard pay
4185,hazard like youtub video chaboyyhd battlefield funni moment duke hazard undercov soldier
