,clean_hex
5638,refuge newlyw feed thousand syrian refuge instead host banquet wed dinner age news
5639,refuge photo young refuge forc flee burundi violenc vice news see
5640,refuge kristindavi un refuge thank un refuge help mani peopl need world  
5641,refuge wowo nigerian refuge repatri cameroon
5642,refuge newlyw feed thousand syrian refuge instead host banquet wed dinner via smh
5643,refuge paci c media centr articl australia rsf protest new secur gag report
5644,refuge recap nigerian refuge repatri cameroon
5645,refuge gener bride earth coupl feed syrian refuge wed day via thedailybeast love
5646,refuge whao nigerian refuge repatri cameroon
5647,refuge return refuge flee amp vietnames govt treat return dutton presser
5648,refuge chpsre rt refuge follow pari visit dream human exhibit rezaphotographi  
5649,rescu policyhold object clico rescu plan
5650,rescu panik kelbytomlinson rescu
5651,rescu coastal german shepherd rescu oc share link animalrescu
5652,rescu ud rescu structur collaps scott road ypre road york truck
5653,rescu rescu day it 
5654,rescu blood pressur med still probabl roof long ppact stori broke involv anim rescu
5655,rescu coastal german shepherd rescu oc share link animalrescu
5656,rescu coastal german shepherd rescu oc share link ecstat rescu racco animalrescu
5657,rescu sugg amp vivian rescu psychrewatch
5658,rescu length rescu cat need
5659,rescu last chanc anim rescu new post animalrescu
5660,rescu last chanc anim rescu new post animalrescu
5661,rescu sammi todd alway rescu may uniform still rescu lmao forev kfc fam
5662,rescu lunch crew made night night long day peac love rescu
5663,rescu tell unit nation plantat forest via rainforestresq
5664,rescu mari come troy rescu
5665,rescu ud rescu structur collaps scott road ypre road york truck
5666,rescu flood zone gener raheel sharif visit chitral also laud effort fwo armi troop armi aviat rescu opera
5667,rescu last chanc anim rescu new post animalrescu
5668,rescu lisavanderpump mani dog rescu dog
5669,rescu offici rescu migrant libya bodi found fox news news
5670,rescu coastal german shepherd rescu oc share link animalrescu
5671,rescu zak bagan sabrina dad rescu dude kept cage sinc
5672,rescu briton rescu amid himalaya flood
5673,rescu kidnap ladi rescu polic enugu nigerian tribun
5674,rescu rescu med migrant arriv sicili
5675,rescu tennoatax hand glass water sit rescu tenno live ship around dojo year
5676,rescu trust us get rescu dopey one val hilari shame probabl go die emmerdal
5677,rescu summer summervib california puppi pitmix rescu brixton banksi happi mybabi
5678,rescu man buri dog aliv thought one would find rescu time
5679,rescu month old babi girl rescu coastguard float half mile sea socialnew
5680,rescu skyrim await rescu
5681,rescu rescu med migrant arriv sicili
5682,rescu finnish hip hop pioneer palefac rescu drift raft brought contain later enkelbiljett menolippu
5683,rescu bovin rescu smugglers 
5684,rescu fund need rescu abandon cocker spaniel
5685,rescu like youtub video romanatwoodvlog rescu sick kitten
5686,rescu news briton rescu amid himalaya flood
5687,rescu brave littl dog get rescu river recoveri inspi via youtub
5688,rescu homeless man travel across usa stray dog rescu get help hand stranger via reshareworthi
5689,rescu brittanypetko break news tonight kid rescu play room week food water parent sex life haha
5690,rescu rescu actual pretend giorgio hiatt
5691,rescu rescu dog least year ago old still sweet ever zak bagan
5692,rescu rescu med migrant arriv sicili hundr migrant rescued 
5693,rescu taken back africa rescu c news
5694,rescu migrant rescu boat capsiz libya
5695,rescu young children among rescu capsiz boat libya via irishtimesworld
5696,rescu hero springer spaniel amp dog dad rescu strand babi dolphin
5697,rescu trust us get rescu dopey one emmerdal summerf
5698,rescu three beach whale rescu kerri
5699,rescu rescu tb goe ribbon hit via offtrackhors
5700,rescu turn back rescu swept away sin though cloud isaiah contemporari english version
5701,rescu zak bagan pet r like part famili love anim last pet rescu break heart anim mistreat
5702,rescu like youtub video homeless dog live cardboard box get rescu amp heartwarm
5703,rescu angri mistrust rescu eleph find peac friendship new home photo via onegreenplanet
5704,rescu photo hundr rescu migrant await disembark irish naval vessel palermo itali tconnellyr 
5705,rescu rescu med migrant arriv sicili
5706,rescuer video pick bodi water rescuer search hundr migrant africa news
5707,rescuer video pick bodi water rescuer search hundr migrant mediterran
5708,rescuer video pick bodi water rescuer search hundr migrant mediterran
5709,rescuer video pick bodi water rescuer search hundr migrant mediterran
5710,rescuer video pick bodi water rescuer search hundr migrant mediterranean
5711,rescuer world fear miss migrant med rescuer search survivor boat carri mani news
5712,rescuer durban knight rescuer search hundr migrant mediterranean boat carr nosi
5713,rescuer unexplain desir watch rescuer childhooddefin
5714,rescuer roddypiperauto fear miss migrant med rescuer search survivor boat carri
5715,rescuer andygild channel rspca dog rescuer infomerci crept back door
5716,rescuer video pick bodi water rescuer search hundr migrant mediterranean boat carryi
5717,rescuer woman 
5718,rescuer video pick bodi water rescuer search hundr migrant mediterran
5719,rescuer video pick bodi water rescuer search hundr migrant mediterran
5720,rescuer video pick bodi water rescuer search hundr migrant mediterranean boat carryi
5721,rescuer video pick bodi water rescuer search hundr migrant africa news
5722,rescuer last second ebay bid rt shaolin rescuer dvd shen chan nan chiang five venom kung fu pleas favori
5723,rescuer video pick bodi water rescuer search hundr migrant mediterranean boat carryi
5724,rescuer worldnew video pick bodi water bbc news home rescuer search hundr
5725,rescuer video pick bodi water rescuer search hundr migrant mediterran
5726,rescuer video pick bodi water rescuer search hundreds 
5727,rescuer ah maze stori power anim rescuer starv homeless dog futur rescu person
5728,rescuer rescuer search hundr migrant mediterranean boat carri mani peopl capsiz coast of 
5729,rescuer news mani death shipwreck rescuer tri save hundr migrant via thenewshyp
5730,rescuer video pick bodi water rescuer search hundr migrant mediterran
5731,rescuer video pick bodi water rescuer search hundr migrant mediterran
5732,rescuer rescuer found bare aliv idea allerg
5733,rescuer fear miss migrant med rescuer search survivor boat carri mani migrant
5734,rescuer video pick bodi water rescuer search hundr migrant mediterranean boat carryi
5735,rescuer woman gp app guid rescuer injur biker marin counti sfgate
5736,rescuer fear miss migrant med rescuer search survivor boat carri mani migrants 
5737,rescuer rescuer find survivor nepal earthquak buri
5738,rescuer rescuer recov bodi year old calgari man lake near vulcan  
5739,rescuer fear miss migrant med rescuer search survivor boat carri mani migrants 
5740,rescuer video pick bodi water rescuer search hundr migrant bbc news
5741,riot meat love feminist world riot grill arriv pop quiz prefer fem art
5742,riot stuart broad take eight joe root run riot aussi
5743,riot piprhi predict riot
5744,riot teamvodg discov nickcannon listen buy realmandyrain riot itunesmus itun  
5745,riot meat love feminist world riot grill arriv art
5746,riot rascal flatt riot tour atlant citi beach concert august ticket
5747,riot meat love feminist world riot grill has 
5748,riot serious tactic riot headquart disney marvel
5749,riot dani riot keep eye look lot new team member come day week
5750,riot meat love feminist world riot grill arriv pop quiz prefer feminist
5751,riot live workshop selfi booth riot kappa
5752,riot acaciapenn start big ass riot send jail today mf shidddd
5753,riot riot kit bah part new concept gear come autumn winter menswear fashion urbanfashion 
5754,riot abran caballero discov nickcannon listen buy realmandyrain riot itunesmus itun  
5755,riot like youtub video thorin thought riot sandbox mode lol
5756,riot stuart broad take eight joe root run riot aussi stuart broad took career best figur
5757,riot retweet sarah silverman sarahksilverman soundtrack walk start w tracey ullman know perfect
5758,riot meat love feminist world riot grill arriv
5759,riot time riot realli make offici satan teemo skin
5760,riot like youtub video sick riot shield slide spot
5761,riot bytorrecilla torrecilla alway info secret lol game check secret get riot point bio
5762,riot transwomen drag queen color lead riot well known butch lesbian usual credit incit
5763,riot eac au pre order film itun amp watch yay
5764,riot without alli near use skill get hire realli caus make everi riot staff member look incompet
5765,riot pop quiz prefer feminist revolut fri ravioli 
5766,riot meat love feminist world riot grill arriv oliviamil
5767,riot davidjordan stephanenni except know start riot even make sens credit particular individu
5768,riot trollkratto juan carlo salvador secret tip get riot point lol check secret bio
5769,riot southeast dirt riot seri crown champion southeast dirt riot seri crown championsblackfoot id
5770,riot sweetpea run riot allot brighten raini day
5771,riot stuart broad take eight joe root run riot aussi
5772,riot riot polic interven southampton vitess arnhem support clash  
5773,riot jwalkerlyl discov nickcannon listen buy realmandyrain riot itunesmus itun  
5774,riot cracker white riot nowplay
5775,riot govern care polic stop riot eventu protestor eventu skyscrap becom plant cover
5776,riot new doco tonight pm setanta sport ireland freeview largest polic presenc soccer game ireland stop prevent riot
5777,riot eric clapton shot sheriff guess mani peopl riot right none
5778,riot kill val riot emmerdal
5779,riot money buy happi lie tell poor peopl keep riot
5780,riot bloodi hell alreadi upgrad riot hyperbol saintsfc
5781,riot twitter count riot financi collaps brazil rio
5782,riot would black dude antioch would riot
5783,riot runjewel recent met bbc discuss race relat america amp benefit riot loveislov
5784,riot reuter peopl like charg inevit riot contribut lie
5785,riot cindi noonan cindynoonan heartbreak baltimor riot yahistor undergroundrailraod
5786,riot leed fan riot embra lower tier leagu cup final dee dum
5787,riot still riot coupl hour left class
5788,riot cloydriv plenti black peopl riot tosu championship well
5789,riot evacid ferguson riot work next time say riot chang anyth fix
5790,riot bbcnew ass british insur say riot cost insur amp million polic number reduc blind fat contr
5791,riot bhramabul watch run jewel use fact defend riot ferguson social mind duo take
5792,riot think twitter invent keep us insomniac riot wee small hour
5793,riot blutz peopl riot justic serv murder behind bar simpl justic peac justic peac
5794,riot still riot gmail
5795,riot jasalhad brianboru jimskiv hijink riot
5796,riot ryleedown nevaehburton get money tomorrow riot
5797,riot rt sweden venezuela day riot venezuela riot direct gr 
5798,riot davidolszak riot happi valley penn state lose
5799,riot aelinrhe group mascara smear girl riot horrif think
5800,riot last time high profil name due sign nffc citi riot wesley verhoek household name tpanic
5801,riot georgou altern legal altern protest riot may peac thing demonstr
5802,riot halljh sick crimin parent friend riot kill polic give damn offic
5803,riot blutz riot began prior decis indict realli make sens point 
5804,riot ash test match current interest stupid congress riot
5805,riot peopl riot everywher think one usami san lt
5806,riot footbal hooligan jail riot game scotland alreadi ban match england uknew
5807,riot cindi noonan cindynoonan heartbreak baltimor riot yahistor undergroundrailraod
5808,riot bbcnew ass british insur say riot cost insur million polic number reduc blind fat control
5809,riot fa af live amp famili live countri looter shot sight riot toler
5810,rubbl refus let life reduc rubbl shit keep pile get shovel expirehc
5811,rubbl china stock market crash gem rubbl china 
5812,rubbl go nuclear arm race go make rubbl bounc winston churchil
5813,rubbl accionempresa china 
5814,rubbl accionempresa china 
5815,rubbl parent impuls sometim rememb come home room fill dust amp rubbl want redesign
5816,rubbl turn rubbl disast lego brick build hous one belong crazyideascolleg
5817,rubbl wisenew china stock market crash gem rubbl
5818,rubbl forb china stock market crash gem rubbl china 
5819,rubbl forb europ china stock market crash gem rubbl
5820,rubbl china 
5821,rubbl jasonpop johnfugelsang say refer main build hit rubbl
5822,rubbl china stock market crash gem rubbl
5823,rubbl wisenew china stock market crash gem rubbl
5824,rubbl jun yemeni search survivor rubbl hous old citi san 
5825,rubbl china stock market crash gem rubbl forbesasia
5826,rubbl steve buscemi firefightr b fame amp workd hr shift diggin thru wtc rubbl lookg survivor
5827,rubbl china stock market crash gem rubbl tcot p news
5828,rubbl china stock market crash gem rubbl china 
5829,rubbl found diamond rubbl
5830,rubbl tnn china stock market crash gem rubbl
5831,rubbl china stock market crash gem rubbl roimentor yycwalk
5832,rubbl china stock market crash gem rubbl
5833,rubbl wisenew china stock market crash gem rubbl
5834,rubbl new post china stock market crash gem rubbl
5835,rubbl china stock market crash gem rubbl china 
5836,rubbl photo postapocalypticflimflam prod around rubbl
5837,rubbl wisenew china stock market crash gem rubbl
5838,ruin okgabbi damn suh let ruin year bruh year better start carpool like back day
5839,ruin ruin mood may lost direct
5840,ruin ruin everyth
5841,ruin quot never let problem ruin faith
5842,ruin im anxiou though mani ppl watch meet make uncomfort cant let ruin moment
5843,ruin smoker ruin new car smell
5844,ruin chrisdyson wait friend mta ruin sorrybutitstru
5845,ruin realli sad red close yuppi n tourist ruin everyth
5846,ruin alway got ta ruin mood
5847,ruin understand want hang guy friend give space ruin trust
5848,ruin like earth would want anybodi unhappi purpos ruin somebodi els happi
5849,ruin fresh da shower lookss still love new hair ruin brand ye
5850,ruin savannahross see tryna ruin life
5851,ruin well done everyon applaud terrif never ruin anyth
5852,ruin four thing may ruin person injuri accid claim
5853,ruin ruin holiday wordk zmne
5854,ruin everi time realli good day someon ruin
5855,ruin wan na ruin relationship ask intent
5856,ruin go ruin someth aw minion
5857,ruin realli aw cant even work make artist ruin thing
5858,ruin damn wale know ruin song
5859,ruin caus play like symphoni play till finger bleed greatest masterpiec ruin
5860,ruin famili ruin someth actual go good
5861,ruin hate im awkward ruin thing
5862,ruin long road ruin foo fighter
5863,ruin u ruin everyth tarbox u ruin sour cream u put brick chees freezer dummi
5864,ruin let asshol ruin night
5865,ruin lol real issu way nfl tri ruin guy legaci
5866,ruin rt ruin connormidd day
5867,ruin greedi bastard fullscreen way ruin creativ censorship youtub
5868,ruin juliechen gon na ruin game vanessa great player
5869,ruin clnv ye ye dont wan na ruin life lol
5870,ruin nbc wan na see reboot fresh princ bel air bring back origin cast everyth amp noth ruin show
5871,ruin make happi fuck tryna ruin keep smile
5872,ruin peopl let ruin life soul cervix everyth odel definit top list
5873,ruin ruin life
5874,ruin babe gon na ruin let stay
5875,sandstorm ctaztroph everyth must ok listen sandstorm
5876,sandstorm watch airport get swallow sandstorm minut
5877,sandstorm watch airport get swallow sandstorm minut
5878,sandstorm hienshi gbay wouldnt turn sandstorm riot gave good answer instead gave dumb excus least new client
5879,sandstorm watch airport get swallow sandstorm minut
5880,sandstorm like youtub video darud sandstorm
5881,sandstorm watch airport get swallow sandstorm minut
5882,sandstorm watch airport get swallow sandstorm minut
5883,sandstorm watch airport get swallow sandstorm minut
5884,sandstorm watch airport get swallow sandstorm minut
5885,sandstorm watch airport get swallow sandstorm minut
5886,sandstorm sandstorm jordan coat middl east 
5887,sandstorm sandstorm woo hoo
5888,sandstorm watch airport get swallow sandstorm minut
5889,sandstorm watch airport get swallow sandstorm minut
5890,sandstorm watch airport get swallow sandstorm minut
5891,sandstorm watch airport get swallow sandstorm minut
5892,sandstorm need friend booz darud sandstorm
5893,sandstorm socialwot globi inclus rt nrc middleeast sandstorm engulf caravan tent zaatari refuge camp  
5894,sandstorm watch airport get swallow sandstorm minut
5895,sandstorm watch airport get swallow sandstorm minut
5896,sandstorm watch airport get swallow sandstorm minut
5897,sandstorm watch airport get swallow sandstorm minut
5898,sandstorm watch airport get swallow sandstorm minut
5899,sandstorm sundercr two hour sandstorm remix merg togeth song silenc
5900,sandstorm watch airport get swallow sandstorm minut
5901,sandstorm watch airport get swallow sandstorm minut
5902,sandstorm put sandstorm
5903,sandstorm watch airport get swallow sandstorm minut
5904,sandstorm watch airport get swallow sandstorm minut
5905,sandstorm watch airport get swallow sandstorm minut
5906,sandstorm come sandstorm tryout aug th lower woodland ms tryout pmh tryout pm
5907,sandstorm watch airport get swallow sandstorm minut
5908,sandstorm villicanaalicia darud sandstorm
5909,sandstorm listen darud sandstorm without expect airhorn
5910,sandstorm play darud sandstorm radio edit
5911,sandstorm watch airport get swallow sandstorm minut
5912,scream slam phone ground scream ahahahga
5913,scream infinitegrac scream world much love littl poni
5914,scream updat polic seem like nice enough peopl felt bad transform scream worri unconsci
5915,scream someon gon na get scream get lyric wrong lmao
5916,scream scream sidjsjdjekdjskdjd cant stand
5917,scream godof mischief loki dagger pull jam mina thigh mina scream grab leg sif
5918,scream omfg didnt expect drag first song pandora play omfg scream loudmi cowork scare
5919,scream scream got microchip needl tbh would cri needl massiv ya haram
5920,scream heard steven univers theme song upstair scream name part song scare cousin
5921,scream mogacola zamtriossu scream hit tweet
5922,scream girl next scream fuck chonc cryibg
5923,scream thought loudest goal ever scream higuain offsid goal germani
5924,scream ran earbud realiz mean probabl polit say hi jare less scream
5925,scream got scream ask dad move half step could get
5926,scream cortezera dead ass scream sign fuck believ
5927,scream stop believ came radio restaur lil white bit scream mommi song
5928,scream brook face time concert scream minut straight
5929,scream want make tweet much dislik today femnism movement want scream
5930,scream peopl scream right ear week camp twenti six still day left cedarglad
5931,scream kid go leadership camp came work today ask bathroom inner asb kid scream lot miss camp
5932,scream vacat updat great aunt kill spider bare hand scream fear fierc
5933,scream want cheat anyth feel good vent twitter without txt scream lol
5934,scream sorri wild show like wwa show niall start sing steal girl liter scream shut fuck
5935,scream scream languag good
5936,scream scream end oamsgajagahahah im laighign otrametlif
5937,scream never scream loud
5938,scream scream what chonc
5939,scream real liam payn scream top lung said guy would come back keep promis addtexastonext dtour
5940,scream thatwitchem emmachosenon jessienovoarp jessi novoa liana novoa scream
5941,scream arianagrand liter walk concert scream soul bless
5942,scream scream fuck hond
5943,scream scream toddyrockstar
5944,scream kinda scream gt lt
5945,scream dont even rememb slsp happen rememb like wtf light turn everyon scream encor
5946,scream love wake dad scream
5947,scream quiet enough liter hear phandom scream tyler tweet
5948,scream scream fangirl oh god
5949,scream drag last night scream shell mannequin instead shell man think everyon hate
5950,scream camilacabello intern extern scream
5951,scream cue jariana stan scream
5952,scream bizzlemahomi scream
5953,scream camilacabello im intern scream
5954,scream estellasreveng first time went swime basic scream smell tast bad
5955,scream scream mariahcarey arianagrand
5956,scream lhh silent scream master
5957,scream noahshack hot amp sing scream
5958,scream fine babi scream tv x
5959,scream harsh follow us abett daybi sarah crace thought scream sirenspac back forth
5960,scream fav scream fuck loud
5961,scream tyleroakley im scream
5962,scream scalpium scream
5963,scream camila follow spree tonight im scream happi
5964,scream stvmlli sorri scream safferoonicl car kinda know peopl let yell
5965,scream dad scream coach alway gave vocal chord quit workout field funnydadcoach
5966,scream peopl know kendal jenner time instagram follow gd scream lmao
5967,scream missdaoh scream babi would love much
5968,scream arianagrand justinbieb scream omg idol day wdym
5969,scream justinbieb arianagrand hear scream
5970,scream kamkasteiiano bluntedjayt fuck scream
5971,scream arianagrand justinbieb love scream one
5972,scream hey lone girldid tell friendsabout way got scream name
5973,scream nochilllukehammingsim scream
5974,scream danisnotonfir follow go town advertis youtub channel scream walk around sign pl
5975,scream justinbieb arianagrand scream
5976,scream blanksocietyx emmerdal im scream he favourit
5977,scream justinbieb arianagrand im scream
5978,scream scream differ languag
5979,scream justinbieb scream hell ye ahhhh omg
5980,scream like littl boy better sit ass stop scream mother stop pull hair amp cri like year old amp grow tf
5981,scream arianagrand justinbieb omgggg im scream
5982,scream trombonetristan ooooohshit ooohshit scream hell love
5983,scream danemillar scream
5984,scream scream distanc
5985,scream phone worstoverdos scream jaileen cake phone everyon look
5986,scream scream differ languag
5987,scream scream intern
5988,scream scream
5989,scream himeruisu go ram ass hard shove face pillow muffl scream pain pleasur
5990,scream come downstair tri look normal possibl front mom rhiannon scream hungov huh uhmmmm
5991,scream hit tailor fuck made doubl play kay scream rob hit
5992,scream appar face scream get emot attach cheat
5993,scream drag nking scream scare animatron
5994,scream get battlefield scream mic cunt
5995,scream still echo scream
5996,scream everi bt song jimin scream
5997,scream casual phone jasmin cri scream spider
5998,scream realjaxclon scream
5999,scream updat rli life scream vibrat cant handl
6000,scream saku uchiha ya boi luke scream get face full saku genit
6001,scream heyot im home need watch scream
6002,scream light recent event would like say scream five year
6003,scream lawsonoffici follow contain scream joy thankyou
6004,scream tile zacb dell tablet scream win
6005,scream ollymursau feel sorri piec meat nice guy peopl need rush scream face
6006,scream agre certain cultur appropri thing honestli u look hous scream appropri bc buddha stuff
6007,scream looney tune blake griffin commerci scream make space jam
6008,scream scream everyon oh wait schoolokim ok
6009,scream aw man apollo crew scream think name black guy quick name mash togeth
6010,scream queenwendi go sleep someon scream us
6011,scream go concert someon scream ear look like wan na loos hear anytim soon
6012,scream wisdc amp obama support death usa
6013,scream littl girl next see spot light sky scream mom look see angel sky
6014,scream harveymain aaaa ok lem move anoth roomr one hear gay ass scream
6015,scream scream
6016,scream scream mother
6017,seismic oil ga explor
6018,seismic man read list famou musician oppos nuclear power wow power evid must know lot seismic risk
6019,seismic seismic risk comparison case studi calabria malta
6020,seismic hebrooon u better learn deriv formula seismic rather think thing like thing like haha
6021,seismic explor take seismic shift gabon somalia
6022,seismic oil ga organ real time insight cyber threat see ey help
6023,seismic explor take seismic shift gabon somalia worldoil subscript somalia
6024,seismic alabamaquak seismic summari w earthquak news amp histori
6025,seismic seismic appl tv servic stream channel across
6026,seismic marek zar cring blow let marek go use seismic toss
6027,seismic seismic audio sa sa pad black speaker cover qti pair
6028,seismic sismo detectado jap 
6029,seismic use perfor metal shear panel sfor seismic resist applic
6030,seismic report ibaraki prefectur of depth km maximum seismic intens earthquak
6031,seismic thank benson amp clegg follow check map
6032,seismic thursday updat kml seismic explor vessel offshor oil
6033,seismic oil ga explor take seismic shift gabon somalia bloomberg somalia
6034,seismic kakajambori u control futur india yor subject explor seismic mainten electr mechan
6035,seismic sismo detectado jap 
6036,seismic agenc seek comment seismic permit
6037,seismic still plan worri got cover plenti seismic ipa seismic squeez radler help
6038,seismic oilandga explor take seismic shift gabon somalia via busi
6039,seismic explor take seismic shift gabon somalia
6040,seismic new post seismicsoftwar major challeng channel sale enabl
6041,seismic panoram resourc cut job seismic event
6042,seismic england east coast dogger bank westward seismic survey progress v western regent tow metr long cabl within area 
6043,seismic subcontractor work french seismic survey group cgg kidnap cairo held islam state compani said w 
6044,seismic art world seismic shift back oddbal observ
6045,seismic sismo detectado jap 
6046,sinkhol sinkhol selfi wont believ brooklyn sinkhol sinkhol selfi wont beli
6047,sinkhol mrw sinkhol open beneath friend gif funni lol comedi ifunni video imag rt
6048,sinkhol talk goz fantast interest fact far manual bought ru domain sinkhol rather seek co op
6049,sinkhol noth surpris anymor sure come
