,clean_hex
0,ablaz deed reason earthquak may allah forgiv us
1,ablaz forest fire near la rong sask canada
2,ablaz resid ask shelter place notifi offic evacu shelter place order expect
3,ablaz peopl receiv wildfir evacu order california
4,ablaz got sent photo rubi alaska smoke wildfir pour school
5,ablaz rockyfir updat california hwi close direct due lake counti fire cafir wildfir
6,ablaz ablaz world wide flood disast heavi rain caus flash flood street manit colorado spring area
7,ablaz top hill see fire wood
8,ablaz emerg evacu happen build across street
9,ablaz afraid tornado come area
10,ablaz three peopl die heat wave far
11,ablaz haha south tampa get flood hah wait second live south tampa gon na gon na fvck flood
12,ablaz rain flood florida tampabay tampa day lost count
13,ablaz flood bago myanmar arriv bago
14,ablaz damag school bu multi car crash break
15,ablaz man
16,ablaz love fruit
17,ablaz summer love
18,ablaz car fast
19,ablaz goooooooaaaaaal
20,ablaz ridicul
21,ablaz london cool
22,ablaz love ski
23,ablaz wonder day
24,ablaz looooool
25,ablaz way eat shit
26,ablaz nyc last week
27,ablaz love girlfriend
28,ablaz cooool
29,ablaz like pasta
30,ablaz end
31,ablaz bbcmtd wholesal market ablaz
32,ablaz alway tri bring heavi metal rt
33,ablaz africanbaz break news nigeria flag set ablaz aba
34,ablaz cri set ablaz
35,ablaz plu side look sky last night ablaz
36,ablaz phdsquar mufc built much hype around new acquisit doubt set epl ablaz season
37,ablaz inec offic abia set ablaz
38,ablaz barbado bridgetown jamaica  
39,ablaz ablaz lord
40,ablaz check nsfw
41,ablaz outsid ablaz alivebut dead insid
42,ablaz awesom time visit cfc head offic ancop site ablaz thank tita vida take care us
43,ablaz soooo pump ablaz southridgelif
44,ablaz want set chicago ablaz preach hotel
45,ablaz gain follow last week know stat grow
46,ablaz west burn thousand wildfir ablaz california alon
47,ablaz build perfect tracklist life leav street ablaz
48,ablaz check nsfw
49,ablaz first night retain quit weird better get use wear everi singl night next year least
50,ablaz deputi man shot brighton home set ablaz
51,ablaz man wife get six year jail set ablaz niec
52,ablaz santa cruz  
53,ablaz polic arsonist deliber set black church north carolina 
54,ablaz noch el bestia alexi sanchez happi see teammat train hard goodnight gunner
55,ablaz kurd trampl turkmen flag later set ablaz other vandal offic turkmen front diyala
56,ablaz truck ablaz r voortrekk ave outsid tambo intl cargo section
57,ablaz set heart ablaz everi citi gift everi skylin like kiss upon lip  
58,ablaz sky ablaz tonight lo angel expect ig fb fill sunset shot know peep
59,ablaz west burn thousand wildfir ablaz california alon climat energi
60,ablaz revel wmv video mean mac farewel ablaz wmv en rout dvd gtxrwm
61,ablaz progress greet month student would set pen ablaz torch public
62,ablaz rene ablaz amp jacinta secret k fallen sky edit mar
63,ablaz navista steve fire someth els california tinderbox clown set hood ablaz news
64,ablaz nowplay rene ablaz amp ian buff magnitud edm
65,ablaz nxwestmidland huge fire wholesal market ablaz
66,ablaz ablaz time talk go know make due work
67,accid kid cuz got bicycl accid amp split testicl imposs kid michael father
68,accid accid w nashvilletraff traffic move slower usual
69,accid accid center lane block santaclara us nb great america pkwi bayarea traffic
70,accid personalinjuri accid summer read advic amp see solicitor help otleyhour
71,accid stloui caraccidentlawy speed among top caus teen accid car accid tee 
72,accid report motor vehicl accid curri herman rd near stephenson involv overturn vehicl pleas use
73,accid bigrigradio live accid awar
74,accid mile marker south mooresvil iredel vehicl accid ramp close pm
75,accid rt sleepjunki sleep pill doubl risk car accid
76,accid accid knew gon happen
77,accid traffic accid n cabrillo hwi magellan av mir
78,accid mile marker south mooresvil iredel vehicl accid congest pm
79,accid pastor scene accid owner rang rover
80,accid mom get home fast wish mom accid truck spilt mayonnais
81,accid horribl car accid past sunday final abl get around thank god
82,accid wait see piss donni tell anoth accid
83,accid truckcrash overturn fortworth interst click crash gt
84,accid accid ashvil us sb sr traffic
85,accid carolina accid motorcyclist die crash car cross median motorcycl rider travel
86,accid fyi cad fyi accid properti damag nh piner rd horndal dr
87,accid rt naayf first accid year turn onto chandane magu near mma taxi ram halfway turn everyon conf 
88,accid accid left lane block manchest rt nb eddi rd stop go traffic back nh delay min traffic
89,accid accid properti damag piner rd horndal dr
90,accid accid
91,accid fyi cad fyi accid properti damag wpd th st
92,accid pm traffic accid injuri willi foreman rd
93,accid aashiqui actress anu aggarw near fatal accid
94,accid suffield alberta accid
95,accid mile backup south accid block right lane exit langtre rd consid nc nc nc altern
96,accid accid chang life help determin option financi support life care plan go treatment
97,accid break deadli motorcycl car accid happen hagerstown today detail state whag
98,accid flowri marinad accid
99,accid car even week got fuck car accid mf fuck drive
100,accid norwaymfa bahrain polic previous die road accid kill explos
101,accid still heard church leader kenya come forward comment accid issu disciplinari measur arrestpastornganga
102,aftershock aftershock delo scuf ps live game cya
103,aftershock man drive effort get pain man win roger bannist
104,aftershock ir icemoon aftershock djicemoon dubstep trapmus dnb edm danc ices 
105,aftershock victori bargain basement price dwight david eisenhow
106,aftershock ir icemoon aftershock djicemoon dubstep trapmus dnb edm danc ices 
107,aftershock nobodi rememb came second charl schulz
108,aftershock aftershock delo im speak someon use scuf xb peopl end get ps also
109,aftershock harder conflict gloriou triumph thoma pain
110,aftershock growingupspoil go clay pigeon shoot cri aftershock
111,aftershock guess one actual want free aftershock tc
112,aftershock aftershock terrifi best roller coaster ever disclaim
113,aftershock aftershock
114,aftershock ir icemoon aftershock djicemoon dubstep trapmus dnb edm danc ices 
115,aftershock ir icemoon aftershock djicemoon dubstep trapmus dnb edm danc ices 
116,aftershock ir icemoon aftershock djicemoon dubstep trapmus dnb edm danc ices 
117,aftershock kjforday see issu aftershock
118,aftershock ir icemoon aftershock djicemoon dubstep trapmus dnb edm danc ices 
119,aftershock ir icemoon aftershock djicemoon dubstep trapmus dnb edm danc ices 
120,aftershock wisdomw bonu minut daili habit could realli improv life mani alreadi lifehack
121,aftershock aftershock protect profit next global financi meltdown david wiedem
122,aftershock moment get scari roller coaster guy behind scream bloodi murder silverwood aftershock
123,aftershock aftershock  
124,aftershock gt gt aftershock protect profit next global financi book
125,aftershock sometim face difficulti someth wrong someth right joel osteen
126,aftershock thing stand dream tri belief actual possibl joel brown
127,aftershock prais god ministri tell like wdyouth biblestudi
128,aftershock rememb go die best way know avoid trap think someth lose  
129,aftershock tri orang aftershock today life never
130,aftershock onfireand love bb
131,aftershock aftershock
132,aftershock aftershock back school kick great want thank everyon make possibl great night
133,aftershock peopl say done interrupt  
134,aftershock first man get oyster second man get shell andrew carnegi
135,aftershock anyon need p u tonight play hybrid slayer ps eu hmu cod sandscrim empirikgam codawscrim tp kotc tpfa aftershock org
136,airplan accid expert franc begin examin airplan debri found reunion island french air accid expert news
137,airplan accid strict liabil context airplan accid pilot error common compon aviat cr
138,airplan accid crobscarla lifetim odd die airplan accid
139,airplan accid expert franc begin examin airplan debri found reunion island french air accid expert wedn
140,airplan accid alexalltimelow awwww airplan accid gon na die cuti good job
141,airplan accid famili member osama bin laden die airplan accid iron mhmmm gov shit suspect
142,airplan accid man goe airplan engin accid via youtub
143,airplan accid horribl accid man die wing airplan
144,airplan accid cessna airplan accid ocampo coahuila mexico juli kill four men includ state coahuila govern offici
145,airplan accid horribl accid man die wing airplan watchthevideo
146,airplan accid expert franc begin examin airplan debri found reunion island french air accid expert wednesday 
147,airplan accid expert franc begin examin airplan debri found reunion island french air accid expert wednesday began examin
148,airplan accid kca votejkt id mbataweel rip binladen famili member kill airplan accid
149,airplan accid almost sent cowork nude accid thank god airplan mode
150,airplan accid mickinyman theatlant might kill airplan accid night car wreck polit best
151,airplan accid expert franc begin examin airplan debri found reunion island french air accid expert mlb
152,airplan accid unbeliev insan man airport airplan aircraft aeroplan runway accid freaky 
153,airplan accid horribl accid man die wing airplane 
154,airplan accid horribl accid man die wing airplan
155,airplan accid usama bin ladin famili dead airplan crash natur accid
156,airplan accid pilot die plane crash car festiv via youtub crash aircraft airplan pilot death accid carfest
157,airplan accid strict liabil context airplan accid
158,airplan accid dtn brazil expert franc begin examin airplan debri found reunion island french air accid exp
159,airplan accid expert franc begin examin airplan debri found reunion island french air accid expert wedn
160,airplan accid horribl accid man die wing  
161,airplan accid nicol fletcher one victim crash airplan time ago accid left littl bit trauma although
162,airplan accid omg horribl accid man die wing airplan
163,airplan accid omg believ rip bro airplan accid jetengin turbojet bo g
164,airplan accid expert franc begin examin airplan debri found reunion island french air accid expert wednesday began examin
165,airplan accid airplan accid
166,airplan accid phone look like car ship airplan accid terribl
167,airplan accid statist risk get kill cop die airplan accid
168,airplan accid airplan crash hous colombia peopl die accid
169,airplan accid shoot airplan accid
170,airplan accid could drone caus airplan accid pilot worri use drone esp close vicin airport
171,ambul earli wake call sister beg come amp ride w ambul hospit rodkiai
172,ambul twelv fear kill pakistani air ambul helicopt crash
173,ambul two air ambul scene seriou crash two car lorri emsne 
174,ambul twelv fear kill pakistani air ambul helicopt crash reuter yugvani
175,ambul lead emerg servic boss welcom new ambul chariti
176,ambul anyon travel aberystwyth shrewsburi right incid servic halt outsid shrew ambul scene
177,ambul twelv fear kill pakistani air ambul helicopt crash
178,ambul ambul sprinter automat frontlin vehicl choic lez compliant ebay
179,ambul new nanotech devic abl target destroy blood clot
180,ambul skyhawkmm traplord fredosantana lilrees hella crazi fight ambul coupl mosh pit
181,ambul get run ambul lucki justsay randomthought
182,ambul news twelv fear kill pakistani air ambul helicopt crash til dna
183,ambul twelv fear kill pakistani air ambul helicopt crash
184,ambul tanslash wait ambul
185,ambul fouseytub ok need ambul hahahah good
186,ambul ambul sprinter automat frontlin vehicl choic lez compliant ebay
187,ambul pakistan air ambul helicopt crash kill nine
188,ambul thenissonian rejectdcartoon nissan ok need medic assist call ambul need
189,ambul em ny emt petit per hour  
190,ambul twelv fear kill pakistani air ambul helicopt crash
191,ambul twelv fear kill pakistani air ambul helicopt crash
192,ambul ambul sprinter automat frontlin vehicl choic lez compliant ebay
193,ambul ambul sprinter automat frontlin vehicl choic lez compliant ebay
194,ambul kiwi karyn check park lot said last year ambul st john
195,ambul know way ambul come lt lt
196,ambul reuter twelv fear kill pakistani air ambul helicopt crash
197,ambul twelv fear kill pakistani air ambul helicopt crash
198,ambul ambul right outsid work
199,ambul  
200,ambul happen hatzolah em ambul respond dual siren and 
201,ambul twelv fear kill pakistani air ambul helicopt crash
202,ambul twelv fear kill pakistani air ambul helicopt crash
203,ambul twelv fear kill pakistani air ambul helicopt crash worldnew
204,ambul twelv fear kill pakistani air ambul helicopt crash worldnew
205,ambul polic ambul number lesotho bodi know
206,ambul medic aac org surpris still standardis clinic practic across nh ambul trust
207,ambul twelv fear kill pakistani air ambul helicopt crash
208,ambul peopl tri j walk ambul pass hate
209,annihil episod trunk annihil freiza cleanest shit ever show nigga merci
210,annihil shall annihil petebest dessic laid bare shall kneel
211,annihil urib annihil basebal met
212,annihil marksmaponyan hey sundown annihil previou meet celtic inde improv
213,annihil volfan tneazzi mizzou annihil florida past season even end muschamp career compet bama
214,annihil annihil ab
215,annihil annihil statu educ mba behalf easi street careen eovm
216,annihil luka die everyth annihil aloi tranci
217,annihil acarewornheart good un fella sorri get annihil
218,annihil cop pull drunk driver safeti second car hit train via viralspel
219,annihil must annihil
220,annihil cop pull drunk driver safeti second car hit train via viralspel
221,annihil boom countri entir annihil h 
222,annihil amirkingkhan would annihil might well thank floydmayweath
223,annihil one thing sure god promis israel annihil horror iran w nuke
224,annihil violentfeminazi guess ok armenian sinc spent histori get annihil
225,annihil year sinc annihil peopl instantli becam awar abil annihil whole human
226,annihil day tryout went good minu fact stop quickli get short ball annihil toenail injuri even
227,annihil oryx symbol arabian peninsula annihil hunter
228,annihil luka die everyth annihil aloi tranci
229,annihil readi get annihil buc game
230,annihil philipduncan breakfaston peopl annihil last night weather realli philip thought would forecast
231,annihil domain sophist annihil close minut feat zrnf
232,annihil stormbeard steel lord seen juda priest rob came back scorpion support fuck annihil place astonish gig
233,annihil offici skip fantasticfour fant stic whatev hashtag get annihil review bummer
234,annihil tomcatart thu explain annihil case survivor evolv becam godlik
235,annihil complet annihil cech paul keegan time aliv
236,annihil tomcatart annihil legion survivor imperfect hybrid project quickli form new secret cell
237,annihil sirbrandonknt exactli lesnar cena match summerslam last year great brock annihil guy
238,annihil cop pull drunk driver safeti second car hit train via viralspel
239,annihil annihil damascu syrian armi grind  
240,annihil thatd ok complet forthright may also food coma bc kebab tahini pickl also annihil w fri
241,annihil fun fill happi hour simmon bar camden handsom one got annihil apart game
242,annihil juanni beisbol sr annihil ball lgm
243,annihil rvfriedmann hell fraction belief total annihil destruct usa lodisilverado ritzi jewel
244,annihil potu mayb call israel tell sorri pre sold river annihil
245,annihil evildead annihil civil
246,annihil u nation park servic tonto nation forest stop annihil salt river wild hors via chang
247,annihil annihil quarterstaff annihil
248,annihil world annihil vs self transform alien attack extermin human
249,annihil starmad stardat planetari annihil via youtub
250,annihil u nation park servic tonto nation forest stop annihil salt river wild hors via chang
251,annihil u nation park servic tonto nation forest stop annihil salt river wild hors via chang
252,annihil kimkardashian pleas sign share petit save wild hors arizona
253,annihil u nation park servic tonto nation forest stop annihil salt river wild hors via chang
254,annihil theellenshow pleas check salt river hors help stop annihil happen without signatur chang org thx
255,annihil soul punish with 
256,annihil calfreedommom steph mention major contributor annihil israel
257,annihil willienelson need help hors die pleas rt amp sign petit take stand amp voic gilbert
258,annihil reject law misguid fals prophet imprison nation fuel self annihil
259,annihil u nation park servic tonto nation forest stop annihil salt river wild hors via chang
260,annihil annihil jeb christi amp kasich less hour away pleas god allow least one full day
261,annihil barbi twin need help hors die pleas rt amp sign petit take stand amp voic gilbert
262,annihil whippenz need help hors die pleas rt amp sign petit take stand amp voic gilbert
263,annihil hey az sign petit save wildhors tantonationalforest rollingston sing long order
264,annihil stop annihil salt river wild hors via chang
265,annihil sonofbaldwin current nova bookslast check tie book rider die annihil
266,annihil u nation park servic tonto nation forest stop annihil salt river wild hors via chang
267,annihil pleas sign amp rt save saltriverwildhors
268,annihil thank count dant join us follow annihil zone johnni
269,annihil world annihil vs self transform alien attack extermin human
270,annihil u nation park servic tonto nation forest stop annihil salt river wild hors via chang
271,annihil u nation park servic tonto nation forest stop annihil salt river wild hors via chang
272,apocalyps gon na fight taylor soon get
273,apocalyps ohh fukurodani surviv apocalyps bokuto feel horribl poor boy ppor child
274,apocalyps anoth jocelyn birthday apocalyps
275,apocalyps rt janenelson rt stephenscifi adapt watch charli human apocalyps option film sciencefict  
276,apocalyps apocalyps pleas
277,apocalyps anoth hour august pm red rover zombi apocalyps internetradio collegeradi 
278,apocalyps honeybunzgem primalkitchen feel like pull one stage apocalyps
279,apocalyps kinda hot play radio today next diseas apocalyps start everyon care
280,apocalyps apocalyps lol gf
281,apocalyps know question interpret sign apocalyps call
282,apocalyps juli r apocalyps version romeo juliet warmbodi
283,apocalyps apocalyps upon us
284,apocalyps rt fittscott minecraft night lucki block mod bob apocalyps wither amp mod showcas popularmmo vi 
285,apocalyps begin day one snow apocalyps
286,apocalyps rt mother mari short readingapocalyps spirit angel took top enorm high mountain  
287,apocalyps candylit imagin sarumi zombi apocalyps fight back back heart heart convers
288,apocalyps rt zonewolf like youtub video minecraft night lucki block mod bob apocalyps wither amp mo 
289,apocalyps planet lone audienc apocalyps
290,apocalyps dad bought dvd look like scienc doc front read back actual impend biblic apocalyps
291,apocalyps alexandrapullin inde apocalyps come week know
292,apocalyps go look grizzli peak right look like begin dystopian apocalyps movi
293,apocalyps niec ask would scare apocalyps
294,apocalyps storm cairo latest x men apocalyps set photo via yahootv
295,apocalyps minecraft night lucki block mod bob apocalyps wither amp mod showcas popularmmo via youtub
296,apocalyps shot heart xv go total give love bad name heart pierc
297,apocalyps rt geek apocalyps pm gmt hess play dark soul day etcpb
298,apocalyps know go zombi take
299,apocalyps latest bryansing reveal storm queen apocalyps rupaul alexshipppp
300,apocalyps shadow box apocalyps
301,apocalyps short readingapocalyps spirit angel took top enorm high mountain
302,apocalyps enjoy live action attack titan everi time see poster remind freshli clean coif everyon apocalyps
303,apocalyps like youtub video minecraft night lucki block mod bob apocalyps wither amp mod showcas
304,armageddon pbban temporari avysss armageddon kill flag fast xp reason
305,armageddon pbban temporari russaki armageddon kill flag fast xp reason
306,armageddon offici vid doublecup gt gt gt gt trubgm prod thisizbwright gt gt armageddon
307,armageddon ouvindo peac love amp armageddon
308,armageddon best movi ever seen armageddon
309,armageddon bed time wake unless revolut armageddon start
310,armageddon red faction armageddon microsoft xbox full read ebay
311,armageddon katiekatcub alreadi know shit goe world seri armageddon
312,armageddon rt ophiuchu love truelov romanc lith voodoo seduct astrolog rtrrt lotz apocalyps armageddon pla 
313,armageddon im gon na beat armageddon hsu hao got flawless first tri
314,armageddon enew ben affleck know wife kid girl help love sinc armageddon eonlinechat
315,armageddon long coat hand worn certainti armageddon bear sens occas
316,armageddon phone spi hidden back door nsa data mine softwar financi armageddon blog
317,armageddon pbban temporari hyider ghost armageddon kill flag fast xp reason
318,armageddon rt rtrrtcoach love truelov romanc lith voodoo seduct astrolog rtrrt lotz apocalyps armageddon planet 
319,armageddon pbban temporari fighterdena armageddon kill flag fast xp reason
320,armageddon photo sketch base tast armageddon episod startrek to
321,armageddon armageddon
322,armageddon aberdeenfc aberdeenfanpag good luck tomorrow night get coeffici point plz armageddon
323,armageddon paddytomlinson armageddon
324,armageddon rohnertparkdp anoth one histori book thank justic depart way paid incom tax yr
325,armageddon vladimir putin issu major warn late escap armageddon
326,armageddon god kingdom heavenli gov rule peopl earth armageddon
327,armageddon l b entertain lot brucewilli movi dvd die hard monkey armageddon sixth ebay auction
328,armageddon let 
329,armageddon karnythia niec gain abil stand get prepar toddler apocalyps armageddon
330,armageddon check prepper doomsday must librari collect cd shtf preppertalk surviv prepper via ebay
331,armageddon erker eep thought yesterday saw hella scari hail armageddon
332,armageddon ahamedi think messiah alreadi come year ago armageddon dajaal gog amp magog
333,armageddon sadli window reveal microsoft ethic armageddon
334,armageddon armageddon avert el patron ultimalucha
335,armageddon samihonkonen time hour latest seri ww blueprint armageddon extrem impress
336,armageddon european fitba till christma armageddon
337,armageddon christian unit israel cufi jew convert soon die armageddon us
338,armageddon offici vid gt doublecup gt gt gt gt trubgm prod thisizbwright gt gt armageddon
339,armageddon tomorrow day start armageddon preseasonworkout
340,armageddon lee comedi  
341,armageddon chart prove financi crisi part begun financi armageddon econom collaps blog track tren
342,armageddon paul craig robert  
343,armageddon rohnertparkdp stage right light funni get goofbal staff pd
344,armageddon offici vid thereal gt gt gt gt gt gt trubgm gt gt gt armageddon comin soon
345,armageddon well done celtic finger cross aberdeen tomorrow night armageddon eh
346,armi beyonc pick fan armi beyhiv
347,armi one direct pick fan armi direction x
348,armi second summer pick fan armi sosfam
349,armi beyonc pick fan armi beyhiv
350,armi beyonc pick fan armi beyhiv
351,armi one direct pick fan armi direction x
352,armi see armi whitewalk first thing slightli intrigu got far
353,armi build kingdom lead armi victori g friend code lzktjnox
354,armi salvat armi host ralli reconnect father children salvat armi host back school rally 
355,armi vote direction vs queen th round billboard fanarmyfaceoff
356,armi build armi dog leader lion dog fight like lion
357,armi show hero tv review
358,armi one direct pick fan armi direction x
359,armi infantri men lume dial armi analog quartz wrist watch sport blue nylon fabric full rea 
360,armi one direct pick fan armi direction x
361,armi victorinox swiss armi date women rubber mop watch
362,armi rt drayesha indiakomuntorjawabdoindian armi ki 
363,armi second summer pick fan armi sosfam  
364,armi beyonc pick fan armi beyhiv
365,armi one direct pick fan armi direction x
366,armi da one mtvsummerstar videoveranomtv mtvhottest britney spear lana del rey
367,armi one direct pick fan armi direction
368,armi stoni jackson america last hope lead armi felon thu armi reject armi satan
369,armi wwi wwii japanes armi navi militari japan leather watch war mido ww full read ebay
370,armi beyonc pick fan armi beyhiv
371,armi beyonc pick fan armi beyhiv
372,armi beyonc pick fan armi beyhiv
373,armi beyonc pick fan armi beyhiv
374,armi potu appoint brig gen richard g kaiser member mississippi river commiss learn mrc
375,armi ap violent countri get armi involv help control kill bring back peac poor peopl
376,armi wwi wwii japanes armi navi militari japan leather watch war mido ww full read ebay
377,armi wwi wwii japanes armi navi militari japan leather watch war mido ww full read ebay
378,armi one direct pick fan armi direction x
379,armi one direct pick fan armi direction
380,arson two jewish terrorist charg histor church arson ugli truth
381,arson spokan author say struggl solv arson case like today hamilton
382,arson thousand attend ralli organ peac protest arson attack took life
383,arson add familia arson squad
384,arson anoth fake hate crime lesbian burn hous els new
385,arson lo angel time arson suspect link fire caught northern newsintweet
386,arson mourn notic stab arson victim stir  
387,arson mourn notic stab arson victim stir  
388,arson sound arson
389,arson owner chicago area gay bar admit arson scheme lgbt
390,arson wait
391,arson arson suspect link fire caught northern california
392,arson trial date set man charg arson burglari
393,arson death palestinian toddler arsonattack israel crack jewish
394,arson palestinian teen kill amid protest arson attack
395,arson kisii polic kisii hunt student fail arson plot polic kisii hunt student countynew
396,arson mariah get thick shoulder poor girl
397,arson mourn notic stab arson victim stir  
398,arson relaxinpr miprv rt latim arson suspect link fire caught northern california
